{
  "blocker_id": "blocker-resource-404-001",
  "tenant_id": "tenant-ahd",
  "project_id": "project-ahd",
  "run_id": "run-step-1-0001",
  "step_id": "1",
  "blocker_type": "quality",
  "title": "Resource 404 requires disposition",
  "description": "The resource 404 must be resolved or waived before the affected scope can proceed.",
  "blocking_scope": "artifact",
  "status": "open",
  "artifact": {"artifact_id": "artifact-step-1-0001", "content_sha256": "aaaaaaaaaaaaaaaaaaaaaaaaaaaaaaaaaaaaaaaaaaaaaaaaaaaaaaaaaaaaaaaa", "revision": 1},
  "evidence": [{"evidence_id": "evidence-crawl-0001", "content_sha256": "bbbbbbbbbbbbbbbbbbbbbbbbbbbbbbbbbbbbbbbbbbbbbbbbbbbbbbbbbbbbbbbb"}],
  "reported_by": "operator-raphael",
  "reported_at": "2026-08-19T12:00:00Z"
}
